sent_id,sent_text,sent_label1,sent_label2,sent_label3
7-75403-2,"Veo todos los días como gente tira papeles al suelo teniendo a dos pasos una papelera, gente con perros dejar la mierda y si es en medio de la calle mejor que mejor, que casualidad que los niños nada de nada.",NO,SPAM,NONE
7-76716-0,"No he dicho que el problema sean los niños, lo que hago es responder a una persona que dice que hay que hacer un plan global de educación para que la gente no sea guarra, a esto he respondido que estoy de acuerdo en que hay que hacerlo, pero que como educar toma tiempo, al menos 10 años para cambiar significativamente las costumbres gracias a los chavales que van saliendo con esta educación recibida, y que no me apetece tener la ciudad hecha un asco tanto tiempo; por lo tanto, creo que hay que tener buenas brigadas de limpieza y además actuar en la educación de las personas, no solo de los niños.",YES,CLAIM,NONE
7-85677-0,"De acuerdo pero a los guarros la educación solo les entra cuando les tocan el bolsillo, unas cuantas multas a los guarrazos y ya verá como cunde el ejemplo, sucedió lo mismo en tráfico hasta que no apareció el carnet por puntos y sus consecuencias no hubo un resultado efectivo.",YES,CLAIM,NONE
7-83302-0,Si porque los carteles nuevos que han puesto no son muy eficaces.,NO,SPAM,NONE
7-83302-1,Al menos en mi barrio en usera.,NO,SPAM,NONE
7-83302-2,Se debería realizar un estudio para ver si esos carteles realmente redujeron la basura en las zonas donde los pusieron o sólo sirvieron para gastar dinero en unos cartelitos muy bonitos pero no tengo la certeza de que sirvan para algo.,YES,CLAIM,NONE
7-83302-3,Y a las pruebas me remito.,NO,SPAM,NONE
7-83302-4,Mi barrio está sucio.,NO,SPAM,NONE
7-85676-0,"Lo mismo que mi barrio, Arganzuela también está muy sucio pero no porque no limpien que limpian sino porque hay unos cuantos guarros que les encanta esparcir basura por todos los lados, por lo que recomiendo educación ya que parece que los cartelitos no son útiles a base de multazo a los guarros.",YES,CLAIM,NONE
7-17369-0,Propuesta relacionada: multar por los excrementos de lso perros: .,NO,SPAM,NONE
7-17376-0,"Esto es lo más importante, calles limpias.",NO,SPAM,NONE
7-17376-1,No sería agradable ir a una ciudad tan bonita como Londres y que estuviese lleno de mierda.,NO,SPAM,NONE
7-46670-0,Hay una propuesta muy buena para acabar con las cacas de los perros en la calle.,NO,SPAM,NONE
7-46670-1,Por favor votadla y dadle difusión.,NO,SPAM,NONE
7-17441-0,"Hay que volverse a sentirse orgulloso de nuestra ciudad, recuperarla, y por muchas cosas que se hagan si no está limpia, lo demás será inútil.",NO,SPAM,NONE
7-46506-0,Hay una propuesta muy buena para acabar con las cacas de los perros en la calle.,NO,SPAM,NONE
7-46506-1,Por favor votadla y dadle difusión.,NO,SPAM,NONE
7-17466-0,"Es lamentable el estado de las calles en la zona centro de Madrid, por no hablar ya en concreto de Malasaña, donde los vecinos tenemos que convivir rodeados de basura, calles llenas de orín, excrementos no solo de animales de 4 patas vómitos, botellas rotas.",NO,SPAM,NONE
7-17466-1,Las únicas calles que se limpian son Espítu Santo y Manuela Malasaña.,NO,SPAM,NONE
7-17466-2,El estado del barrio roza la insalubridad.,NO,SPAM,NONE
7-17466-3,La gestión en cuanto a limpieza ha sido y sigue siendo más que pésima.,NO,SPAM,NONE
7-46669-0,Hay una propuesta muy buena para acabar con las cacas de los perros en la calle.,NO,SPAM,NONE
7-46669-1,Por favor votadla y dadle difusión.,NO,SPAM,NONE
7-17472-0,"Ahora Madrid ya puso planes de limpieza urgentes durante el verano, para adelantar los planes de limpieza regulares, para encontrarse con todo tipo de externalizaciones y contratos blindados por el partido anterior.",YES,PREMISE,REASON
7-17472-1,Llevan en ello desde que llegaron.,YES,PREMISE,REASON
7-17472-2,Convendría informarse antes de hacer proponer iniciativas ciudadanas de este calibre.,YES,CLAIM,NONE
7-17607-0,Pues les ha cundido poco.,NO,SPAM,NONE
7-17607-1,Siguen estando hechas un asco.,NO,SPAM,NONE
7-17923-0,¿De qué sirve limpiar a fondo un tiempo si después se deja de limpiar?.,NO,SPAM,NONE
7-17485-0,"Excepcional inversión en Parque Madrid Rio que todos los madrileños y turistas disfrutan y escasez de servicios esenciales como la limpieza en sus calles adyacentes como Antonio López, donde hay un hotel de 4 estrellas, numerosos negocios de hostelería y comercio y residen tantos vecinos como yo que el fin de semana paseamos entre basura al salir del portal.",NO,SPAM,NONE
7-17534-0,No olviden el problema de limpieza que tenemos en barrios como Villaverde.,NO,SPAM,NONE
7-17534-1,"La limpieza no es suficiente, horas después está nuevamente sucia.",NO,SPAM,NONE
7-17534-2,En este caso principalmente por las personas que rebuscan en las bolsas de la basura.,NO,SPAM,NONE
7-17534-3,"Propongo, además de un plan de información y ayuda para estas personas que por diferentes motivos buscan en la basura y que los contenedores se soterren en todo Madrid.",YES,CLAIM,NONE
7-17534-4,Además multas disuasorias o trabajos de limpieza para aquellas personas que arrojen basura de cualquier tipo al suelo.,YES,PREMISE,ADDITION
7-46505-0,Hay una propuesta muy buena para acabar con las cacas de los perros en la calle.,NO,SPAM,NONE
7-46505-1,Por favor votadla y dadle difusión.,NO,SPAM,NONE
7-46668-0,Hay una propuesta muy buena para acabar con las cacas de los perros en la calle.,NO,SPAM,NONE
7-46668-1,Por favor votadla y dadle difusión.,NO,SPAM,NONE
7-17593-0,"Una parte del problema es que hay que limpiar, otra parte es que hay que no ensuciar, Madrid esta sucio porque la gente es bastante irrespetuosa, deja la basura a las 9 de la mañana en los árboles o al lado de las papeleras, tiran muebles en la acera, doblar una caja de cartón para meterla en un contenedor parece que es algo muy complicado El primer paso para que todo este más limpio es que no se ensucie.",NO,SPAM,NONE
7-17626-0,"Lo ideal es que no se manche, pero lo necesario es que se limpie.",NO,SPAM,NONE
7-17626-1,"Culpar al ciudadano es lo habitual, pero pongo un simil para que se entienda.",NO,SPAM,NONE
7-17626-2,"Si entras en un bar con el suelo lleno de servilletas sucias yo no entro la tendencia es a tirar la servilletas, es un acto inconsciente.",NO,SPAM,NONE
7-17626-3,Si el bar está limpio buscarás la papelera.,NO,SPAM,NONE
7-17629-0,"Lo ideal es que no se manche, pero lo necesario es que se limpie.",NO,SPAM,NONE
7-17629-1,"Culpar al ciudadano es lo habitual, pero pongo un simil para que se entienda.",NO,SPAM,NONE
7-17629-2,"Si entras en un bar con el suelo lleno de servilletas sucias yo no entro la tendencia es a tirar la servilletas, es un acto inconsciente.",NO,SPAM,NONE
7-17629-3,Si el bar está limpio buscarás la papelera.,NO,SPAM,NONE
7-18320-0,"La única basura aceptable en un pueblo culto, es el polvo del ambiente, hojas de árboles, alguna rama y nada más.",NO,SPAM,NONE
7-18320-1,"Todo lo demás proviene de la mano del hombre y no siempre de la mano Los papeles, latas, maderas, vidrios, botellas, plásticos, colillas, heces, vómitos, orines, etc.",NO,SPAM,NONE
7-18320-2,"No llegaron solos a las calles, siempre hay un ciudadano sucio, resentido social, mal educado que expresa su mala conducta arrojando basura-.",NO,SPAM,NONE
7-17844-0,"Hola, en mi opinión no me parece una prioridad a día de hoy.",YES,CLAIM,NONE
7-17844-1,Creo que la ciudadanía deberíamos volcarnos más en acciones que realmente supongan un beneficio inmediato para los habitantes de Madrid.,YES,CLAIM,NONE
7-17844-2,"La limpieza es importante pero no prioritaria, por tanto no apoyaré esta propuesta porque no lo veo prioritario.",YES,PREMISE,RESULT
7-17957-0,¡¿Qué no es prioritario la limpieza de una ciudad? !.,NO,SPAM,NONE
7-46666-0,Hay una propuesta muy buena para acabar con las cacas de los perros en la calle.,NO,SPAM,NONE
7-46666-1,Por favor votadla y dadle difusión.,NO,SPAM,NONE
7-18052-0,Si para ti la limpieza no es prioritaria me imagino que tampoco lo será para ti la sanidad pública.,YES,CLAIM,NONE
7-46665-0,Hay una propuesta muy buena para acabar con las cacas de los perros en la calle.,NO,SPAM,NONE
7-46665-1,Por favor votadla y dadle difusión.,NO,SPAM,NONE
7-18101-0,La higiene pública es una de las máximas de cualquier sociedad civilizada y su ausencia una puerta abierta a otro males.,NO,SPAM,NONE
7-18101-1,"Madrid se encuentra en un estado antihigienico, con evidentes problemas de salubridad en muchos casos Alguien se ha parado a ver el estado de los puntos de recogida en el distrito Centro?",NO,SPAM,NONE
7-18101-2,por ejemplo.,NO,SPAM,NONE
7-18314-0,Por supuesto.,NO,SPAM,NONE
7-18314-1,"Y el problema añadido es que en Madrid llueve poco, un tanto en otoño, algunas gotas en invierno y otro chubasco en primavera, el verano nada de nada, por eso se requiere tanta limpieza.",YES,PREMISE,REASON
7-18314-2,"Necesitamos muchos camiones con mangueras de agua, barrer no es suficiente.",YES,CLAIM,NONE
7-18314-3,Las calles apestan.,NO,SPAM,NONE
7-46664-0,Hay una propuesta muy buena para acabar con las cacas de los perros en la calle.,NO,SPAM,NONE
7-46664-1,Por favor votadla y dadle difusión.,NO,SPAM,NONE
7-18313-0,"Rober, leo estupefacto tu opinión e intuyo que eres uno de los que ensucia Madrid.",NO,SPAM,NONE
7-18313-1,"Si la basura no te parece un problema, creo que tienes un serio problema sobre el concepto de una metropoli y capital de un país tan importante como es España.",NO,SPAM,NONE
7-18912-0,Date una vuelta por Vallecas y después me dices si es una prioridad o no.,NO,SPAM,NONE
7-17858-0,"Hasta el centro esta sucio, la periferia Valdebernardo ya da asco.",NO,SPAM,NONE
7-17858-1,"La basura algún día ni la recogen, basura fuera de los contenedores días y días.",NO,SPAM,NONE
7-17858-2,¿Qué está pasando?.,NO,SPAM,NONE
7-46663-0,Hay una propuesta muy buena para acabar con las cacas de los perros en la calle.,NO,SPAM,NONE
7-46663-1,Por favor votadla y dadle difusión.,NO,SPAM,NONE
7-18024-0,"Es una de las prioridades que deseamos tener los ciudadanos de Madrid, entre comillas, porque parece que se confirma y cada vez a una escala mayor que hay ciudadanos de primera y ciudadanos de segunda.",NO,SPAM,NONE
7-18024-1,"Ejemplos muchos pero aquí va uno muy significativo: El barrio de Salamanca, barrio del Retiro, Puerta del Sol, y alrededores solo 100 metros a la redonda de la Asamblea de Madrid, están impolutos de limpios, pero una calle como es García Miranda, con solo cincuenta metros de longitus, tres papeleras, dos colegios especiales y seis portales de vecinos esta abandonada, papeleras llenas, toda clase de basura debajo de los coches, árboles que se están secando, alcantarillas que no nos dejan dormir por la noche, solares ocupados por camiones de muy dudosa identidad y todo esto a tan solo 300 metros de la puerta principal de La Asamblea de Madrid, y cosa curiosa, por mi calle pasan todos los coches oficiales de los diputados de La Asamblea de Madrid, pero claro como van con cristales tintados.",NO,SPAM,NONE
7-46662-0,Hay una propuesta muy buena para acabar con las cacas de los perros en la calle.,NO,SPAM,NONE
7-46662-1,Por favor votadla y dadle difusión.,NO,SPAM,NONE
7-18124-0,"Hola, incluyo aquí esta otra propuesta relacionada: Plan integral anti grafitis ¡Gracias!.",NO,SPAM,NONE
7-18538-0,Espero que con el cambio de gobierno mejore la limpieza en Madrid.,NO,SPAM,NONE
7-18538-1,"Tengo dos contenedores de vidrio y cartón en la puerta de casa y la gente los usa de basurero colchones, muebles, maderas, ladrillos y lo peor, bolsas de basura orgánica he presentado varias reclamaciones al ayuntamiento y siempre me decían que lo limpian 3 veces al día, pero no es cierto.",NO,SPAM,NONE
7-18538-2,Pueden pasar tres días isn que retiren los desperdicios.,NO,SPAM,NONE
7-18538-3,"También pido que por favor, multan a los que dejan la basura en la calle sin más.",YES,CLAIM,NONE
7-46661-0,Hay una propuesta muy buena para acabar con las cacas de los perros en la calle.,NO,SPAM,NONE
7-46661-1,Por favor votadla y dadle difusión.,NO,SPAM,NONE
7-18541-0,No entiendo que haya gente que diga que la limpieza no es prioridad cuando vivimos entre basura y los problemas de salubridad que supone.,YES,CLAIM,NONE
7-18554-0,Yo esta semana he notado que pasan por la calle a limpiar todos los días cosa que hace mucho tiempo no se hacía no obstante se necesita una limpieza a fondo de calles y contenedores después de años de abandono.,NO,SPAM,NONE
7-18558-0,Incluyo el barrio del PAU de Carabanchel y específicamente las papeleras.,NO,SPAM,NONE
7-18558-1,Están tan a reventar que se sale la basura.,NO,SPAM,NONE
7-46660-0,Hay una propuesta muy buena para acabar con las cacas de los perros en la calle.,NO,SPAM,NONE
7-46660-1,Por favor votadla y dadle difusión.,NO,SPAM,NONE
7-18569-0,"No entiendo que no se exija a la empresa de limpieza contrata que cumpla con su obligación, si alguien tiene una empleada de hogar a la que paga porque le limpie y no lo hace ¿no toma medidas?.",YES,CLAIM,NONE
7-18836-0,El Ayuntamiento debería anular el contrato de limpieza de la ciudad.,YES,CLAIM,NONE
7-18904-0,"Una de las principales pautas por las que valoraré al nuevo gobierno, al que he votado, es por la limpieza.",NO,SPAM,NONE
7-18904-1,"Espero que acabe, lo antes posible, con la dejadez que nos han dejado los anteriores desgobiernos de Madrid.",NO,SPAM,NONE
7-18920-0,"Ese fue uno de mis motivos para votar a este nuevo gobierno y de la vergüenza que sentía al ver tanta suciedad y con la esperanza de que cambiara, pero al ver pasas los meses y no ver mejoría, ya empiezan a decepcionarme.",NO,SPAM,NONE
7-19041-0,"No tengas tanta prisa seamos realistas, no veas el lio que hay montao con los ERTES de limpieza, mientras no se arrelge ese lio no hay barrenderos suficientes.",NO,SPAM,NONE
7-19073-0,Realista es salir a la calle y ver tanta suciedad y pensar dónde vas nuestros impuestos ¿hasta cuándo hay que tener paciencia?,NO,SPAM,NONE
7-19073-1,porque ya llevamos tiempo y con el nuevo gobierno nos gustaría empezar a ver resultados.,NO,SPAM,NONE
7-46659-0,Hay una propuesta muy buena para acabar con las cacas de los perros en la calle.,NO,SPAM,NONE
7-46659-1,Por favor votadla y dadle difusión.,NO,SPAM,NONE
7-19214-0,¿Solo las calles?,NO,SPAM,NONE
7-19214-1,"Hay que luchar también contra la suciedad en las paredes: los grafitis Por favor, apoyad esta otra propuesta para luchar contra esta lacra: Gracias!.",NO,SPAM,NONE
7-46658-0,Hay una propuesta muy buena para acabar con las cacas de los perros en la calle.,NO,SPAM,NONE
7-46658-1,Por favor votadla y dadle difusión.,NO,SPAM,NONE
7-19236-0,"En Aluche tenemos este problema con la suciedad y dejadez del barrio, por favor votad.",NO,SPAM,NONE
7-19385-0,En puente Vallecas esta muy sucio.,NO,SPAM,NONE
7-19445-0,Pero estos que están gobernando ¿no se presentaron con un programa electoral?,NO,SPAM,NONE
7-19445-1,Cúmplanlo o es que no tenían y lo están haciendo ahora.,NO,SPAM,NONE
7-19608-0,De paso se puede abrir el debate que esta asociado a este.,NO,SPAM,NONE
7-19608-1,Soluciones para que los perros no meen por la calle.,NO,SPAM,NONE
7-19608-2,Es una guarrada ver las calles del centro llenas de meadas de perro.,NO,SPAM,NONE
7-19608-3,Ahora limpian más pero aun así es una cerdada.,NO,SPAM,NONE
7-19608-4,Si las personas no podemos mear por la calle porque los perros sí?,NO,SPAM,NONE
7-19608-5,La solución no es sencilla pero seguro que hay ideas.,NO,SPAM,NONE
7-19608-6,"No se, si los habéis enseñado a mear y cagar fuera de casa ¿no les podéis enseñar que solo meen en las jardineras de los árboles?",NO,SPAM,NONE
7-19608-7,"y que el ayuntamiento garantice que las haya por todos lados No sé, pero algo hay que hacer, la zona que hablas por ejemplo es una cardada, las calles de la zona de embajadores-casco es asqueroso como están todos los bolardos y paredes llenas de meadas de perro.",NO,SPAM,NONE
7-19608-8,"No sé, a los dueños, tratar de hacer algo, porque los que no tenemos perros vamos a acabar pensando que lo mejor sería prohibirlos.",NO,SPAM,NONE
7-19608-9,Mejor convivencia respetuosa.,NO,SPAM,NONE
7-19608-10,Una campaña desde el ayuntamiento para concienciar a los dueños de perro no estría mal.,NO,SPAM,NONE
7-21382-0,Que las personas no pueden mear por la calle?,NO,SPAM,NONE
7-21382-1,Ya lo creo.,NO,SPAM,NONE
7-21382-2,Y cagan también.,NO,SPAM,NONE
7-21382-3,Muchas de las meadas que atribuyes a perros lamento decirte que son de paisanos.,NO,SPAM,NONE
7-21382-4,"Por lo demás, no pierdo más tiempo en rebatirte porque no hay por donde coger tu mensaje.",NO,SPAM,NONE
7-46656-0,Hay una propuesta muy buena para acabar con las cacas de los perros en la calle.,NO,SPAM,NONE
7-46656-1,Por favor votadla y dadle difusión.,NO,SPAM,NONE
7-21908-0,Debe usted informarse antes de criticar: Ahora Madrid prácticamente inició su legislatura con el problema de la limpieza.,NO,SPAM,NONE
7-21908-1,"Creó un plan urgente para el verano, pues aún había mucho que hablar con las empresas al cargo, donde se descubrió muchas irregularidades, y había también que hacer todas las gestiones administrativas necesarias, descubriéndose en ello el blindaje de muchos contratos que no se puede rescindir.",NO,SPAM,NONE
7-21908-2,Además se encontraron con el problema de la plaga de los árboles de la zona este.,NO,SPAM,NONE
7-21908-3,"En agosto presentaron el plan de refuerzo de la limpieza, pero aún siguen con el problema de las empresas concesionarias.",NO,SPAM,NONE
7-21908-4,"Lo dicho, antes de criticar, conviene informarse.",NO,SPAM,NONE
7-22352-0,"El responsable único es el Ayuntamiento que debe atajar esta situación y no lo hace, bien por dejadez o bien por decisiones inútiles que solo agravan el problema.",YES,CLAIM,NONE
7-22352-1,Es intolerable que llevemos casi 4 meses y la ciudad este más sucia que nunca.,NO,SPAM,NONE
7-22352-2,Deben solucionarlo ya Queremos hechos no palabras!.,NO,SPAM,NONE
7-46655-0,Hay una propuesta muy buena para acabar con las cacas de los perros en la calle.,NO,SPAM,NONE
7-46655-1,Por favor votadla y dadle difusión.,NO,SPAM,NONE
7-19670-0,Y que me decís de los cerrajeros ensuciando las puertas con pegatinas?,NO,SPAM,NONE
7-19670-1,apoya mi propuesta en.,NO,SPAM,NONE
7-46654-0,Hay una propuesta muy buena para acabar con las cacas de los perros en la calle.,NO,SPAM,NONE
7-46654-1,Por favor votadla y dadle difusión.,NO,SPAM,NONE
7-20685-0,"En Aluche tenemos este problema con la suciedad y dejadez del barrio, por favor votad.",NO,SPAM,NONE
7-21036-0,Pero limpieza limpiando.,NO,SPAM,NONE
7-21036-1,"No con esos camiones que con sus chorros de agua dejan los coches aparcados como si hubiesen realizado el Paris_Dakar, o los portales de madera rotos por la podredumbre de la humedad que dejan día tras día.",NO,SPAM,NONE
7-21036-2,Se han vuelto muy cómodos y caros los servicios de limpieza externalizados.,NO,SPAM,NONE
7-79028-0,No me parece que se deba faltar el respeto para dar una propuesta o algo así.,NO,SPAM,NONE
7-79028-1,Yo quiero un Madrid más limpio.,NO,SPAM,NONE
7-79028-2,Pero hay distritos en los que somos muy cerdos.,NO,SPAM,NONE
7-79028-3,Vivo en Vallecas.,NO,SPAM,NONE
7-79028-4,Y habiendo papeleras he visto.,NO,SPAM,NONE
7-79028-5,", desde colchones en la calle, bolsas de restos de una meréndola de mc donals.",NO,SPAM,NONE
7-79028-6,", latas de bebida.",NO,SPAM,NONE
7-79028-7,", restos de comida en las aceras y así un largo etc. Vivo entre puente y el Pau.",NO,SPAM,NONE
7-79028-8,Y te da igual donde mires.,NO,SPAM,NONE
7-79028-9,Si queremos un barrio limpio empecemos por ser limpios.,NO,SPAM,NONE
7-79028-10,Tengo perros 2 y recojo religiosamente sus cosas siempre.,NO,SPAM,NONE
7-79028-11,Y si no tengo bolsa porque se me terminan siempre hay alguien para dartela.,NO,SPAM,NONE
7-79028-12,Igual que yo las doy.,NO,SPAM,NONE
7-79028-13,No sirve de nada que limpien.,NO,SPAM,NONE
7-79028-14,No hace mucho paso por mis calles en el Pau una cuadrilla.,NO,SPAM,NONE
7-79028-15,Lo dejaron muy bien.,NO,SPAM,NONE
7-79028-16,", y si lo veis ahora.",NO,SPAM,NONE
7-79028-17,Tenemos lo que creamos.,NO,SPAM,NONE
7-79028-18,Barrios guarros porque somos así.,NO,SPAM,NONE
7-79028-19,Yo he estado en el extranjero y la educación y pensamiento civico no tiene nada que ver con lo que hay en este páis.,NO,SPAM,NONE
7-79028-20,Hay que tocar en todos lados.,NO,SPAM,NONE
7-79028-21,Primero los adultos y de ahí para abajo.,NO,SPAM,NONE
7-21545-0,Podrias haber ampliado el terreno al resto de barrios y no solo a Vallecas.,YES,CLAIM,NONE
7-21545-1,"Todo Madrid, en especial los barrios periféricos en mi opinión son los más descuidados.",YES,PREMISE,PRECISION
7-21545-2,"En San Blas he llegado a ver un kiwi reventado en medio de la calle casi una semana, y un pañal usado o no, no lo sé durante casi lo mismo.",NO,SPAM,NONE
7-46653-0,Hay una propuesta muy buena para acabar con las cacas de los perros en la calle.,NO,SPAM,NONE
7-46653-1,Por favor votadla y dadle difusión.,NO,SPAM,NONE
7-21704-0,Y qué tal una campaña para educar a la ciudadanía y enseñarla a ser más limpia?.,YES,CLAIM,NONE
7-21704-1,"No recuerdo ningúna campaña enfocada a enseñar a la gente a mantener limpia su ciudad, tampoco se enseña en los colegios y pocos padres se lo inculcan a sus hijos.",NO,SPAM,NONE
7-21704-2,"Una campaña potente que ayude a concierciarnos que la ciudad no se ensucia sola, si no que la ensucian los malos ciudadanos me parece primordial.",YES,CLAIM,NONE
7-22113-0,Más limpieza en Puente de Vallecas pero tb multas para los infractores.,NO,SPAM,NONE
7-22113-1,Es increible ver como la gente tira todo a la calle.,NO,SPAM,NONE
7-22113-2,"Los paquetes de tabaco vacios, los envases, las cáscaras de frutas.",NO,SPAM,NONE
7-22113-3,Es increible.,NO,SPAM,NONE
7-22113-4,Y digo lo de las multas porque parece que es lo único que entendemos.,NO,SPAM,NONE
7-46652-0,Hay una propuesta muy buena para acabar con las cacas de los perros en la calle.,NO,SPAM,NONE
7-46652-1,Por favor votadla y dadle difusión.,NO,SPAM,NONE
7-22734-0,"Propongo hacer como el las playas, banderas con la categoría de la limpieza de los distritos, para que los vecinos que menos cuiden sus barrios se den cuenta de lo descuidado que lo tienen, a la vez que premiar aquellas personas que tienen perfectamente cuidados sus terrazas y balcones con maravillosas plantas.",YES,CLAIM,NONE
7-46651-0,Hay una propuesta muy buena para acabar con las cacas de los perros en la calle.,NO,SPAM,NONE
7-46651-1,Por favor votadla y dadle difusión.,NO,SPAM,NONE
7-24421-0,"Muy de acuerdo con tu propuesta, pero por favor, incluye un punto en el que diga que: se suprima la tasa de basuras.",YES,CLAIM,NONE
7-24421-1,"Empezaron a cobrarla hace ya unos años, y desde entonces Madrid está mucho más sucio, con lo cual intuyo que esa tasa es para sacarnos los cuartos.",YES,PREMISE,REASON
7-24421-2,"Un saludo, tienes mi apoyo.",NO,SPAM,NONE
7-46650-0,Hay una propuesta muy buena para acabar con las cacas de los perros en la calle.,NO,SPAM,NONE
7-46650-1,Por favor votadla y dadle difusión.,NO,SPAM,NONE
7-46726-0,"Si la propuesta se basa, en que las cacas de los perros vas a limpiarlas tú, la voto y la difundo; si se basa en multar, tasar con impuestos o dañar en cualquier forma a los tenedores de mascotas, mira, imprimes la propuesta, la haces un canutillo y te la metes por el, luego si quieres la defecas en la vía pública, la recoges, y la tiras en una papelera.",NO,SPAM,NONE
7-46726-1,"Para propuestas creadas por un animal de bellota, el mismo tipo de soluciones.",NO,SPAM,NONE
7-46736-0,Me parece que no te has leído la propuesta.,NO,SPAM,NONE
7-46736-1,"Pero si solo querías dejar constancia de tu exquisita buena educación, a lo mejor este no es el foro apropiado.",NO,SPAM,NONE
7-46736-2,Por favor ahórrate la respuesta.,NO,SPAM,NONE
7-46761-0,"Propuesta leída, me reitero en lo dicho anteriormente.",NO,SPAM,NONE
7-46761-1,"Y si tú quieres aprovechar cada comentario que hay escrito en esta propuesta para publicitar tonterías, primero, te has equivocado de persona y segundo, nunca he abierto a los carteros comerciales en mi domicilio, y no lo voy a aguantar también en internet, por lo tanto creo que este tampoco es el lugar apropiado para ti, dedícate a repartir publicidad del telepizza, eres tan cansino que se te dará bien.",NO,SPAM,NONE
7-46761-2,"Me has dicho que me ahorrara la respuesta, pero.",NO,SPAM,NONE
7-46761-3,¿Cómo iba a dejar de brindarte la oportunidad de leer mis palabras?,NO,SPAM,NONE
7-46761-4,"Asi, puedes imprimir también este, y metértelo por donde el anterior, que se que te hace ilusión.",NO,SPAM,NONE
7-46761-5,"A diferencia de ti, me gustaría que me contestaras, pero en caso contrario supongo que estarás liado en el baño, o en la calle buscanco heces.",NO,SPAM,NONE
7-46761-6,Buena suerte.,NO,SPAM,NONE
7-24499-0,Madrid está cada vez más sucio.,NO,SPAM,NONE
7-24499-1,Yo creía que la nueva alcaldesa lo arreglaría y sin embargo está peor que nunca.,NO,SPAM,NONE
7-24499-2,"Esto no es una propuesta nueva sino un deber incumplido y como tal no debería estar aquí, sino en el buzón de quejas y reclamaciones.",NO,SPAM,NONE
7-26854-0,Como nos gusta exigir!,NO,SPAM,NONE
7-26854-1,"Es como tener un hijo y a los 3 días de colegio ya le exigimos que nos traiga las notas con un 10 Seamos sensatos, la culpa no es del nuevo gobierno, sino del anterior y su política de privatización de servicios a través de un contrato a 10 años! ni mal ni menos!",NO,SPAM,NONE
7-26854-2,Con ello ha hipotecado la limpieza de nuestra ciudad!,NO,SPAM,NONE
7-26854-3,Ese anterior gobierno debería pedir disculpas a todos y todas las madrileñas.,NO,SPAM,NONE
7-26854-4,"Demos tiempo al nuevo gobierno para que puedan estudiar, dialogar y legar a las mejores soluciones para que Madrid brille!.",NO,SPAM,NONE
