sent_id,sent_text,sent_label1,sent_label2,sent_label3
25077-199553-1,o como hay muchos más coches que contaminan menos mejor seguimos contra ellos?,NO,SPAM,NONE
25077-199553-2,a los coches ya se les tiene más que restringido y usted pide aún más.,NO,SPAM,NONE
25077-199553-3,A lo demás.,NO,SPAM,NONE
25077-199553-4,"Que más da si usted sólo quiere acabar con los coches, lo demás le da igual.",NO,SPAM,NONE
25077-200001-0,"Yo estoy en contra de cualquier forma de contaminación que se pueda evitar, esto se extrae de cualquiera de mis comentarios, pero se ve que usted no quiere comprenderlo.",YES,CLAIM,NONE
25077-197543-0,Puede que no me acuerde pero dígame cuando ha habido protocolo en verano.,NO,SPAM,NONE
2513-0-0,Identificación de bicicletas,YES,CLAIM,NONE
2513-0-0,Cada vez circulan más bicicletas por las aceras y se saltan normas de tráfico.,YES,CLAIM,NONE
2513-0-1,Para evitar la impunidad se puede tomar los datos de la matrícula para poner la oportuna denuncia.,YES,PREMISE,GOAL
2513-28911-0,"Tienes toda la razón, cada vez hay más bicicletas que se saltan todo tipo de señales, van en dirección contraria, s saltan los semáforos provocando sobre saltos en los transeúntes e incluso cuando van por la acera se permiten el tocar el claxon para que nos apartemos.",YES,CLAIM,NONE
2513-29002-0,"Sin querer quitarte la razón, cuando un ciclista toca el timbre generalmente no es para que te quites sino para que seas consciente de su presencia y así evitar accidentes.",YES,CLAIM,NONE
2513-29002-1,Te lo digo porque yo lo hago mucho con los peatones que van por el carril bicicleta.,YES,PREMISE,REASON
2513-29002-2,"Si no aviso se sobresaltan, incluso si se mueven podíamos chocar.",YES,PREMISE,ADDITION
2513-28928-0,Yo creo que la mayoría de gente que va por las aceras en bicicleta es por miedo a los coches.,YES,CLAIM,NONE
2513-28928-1,"Teniendo en cuenta que Madrid está plagado de policías municipales, estos deberían sancionar con cursos obligatorios de educación víal a los ciclistas que circulen por las aceras o pago de una multa alta En resumen, la educación es la única vía para los comportamientos incívicos.",YES,CLAIM,NONE
2513-28995-0,"Pues yo creo que hay un gran interés por parte de los ciclistas en convertir Madrid en una ciudad amigable con la bicicleta, pero el miedo al tráfico rodado hace que algunos se decidan por la acera.",YES,CLAIM,NONE
2513-28995-1,Creo que hay que empezar a tomar la bicicleta en serio a nivel infraestructuras.,YES,CLAIM,NONE
2513-28995-2,Espero igualmente que todas esas voces que reclaman multas para las bicicletas por las aceras no sean los mismos que acosan a los ciclistas con sus coches por las calzadas.,YES,CLAIM,NONE
2513-28995-3,Desgraciadamente muchas veces es así y lo que pasa es que quienes son intolerantes lo son siempre.,YES,PREMISE,ADDITION
2513-28995-4,Quede claro que del mismo modo pido a los ciclistas que intenten evitar ir por las aceras y que sean respetuosos para que también lo sean los demás con nosotros.,YES,PREMISE,CONCESSION
2513-29064-0,"Yo no pido multas, si no todo lo contrario.",YES,CLAIM,NONE
2513-29064-1,"Como se que es un problema de miedo a los coches, pues lo que quiero es que aprendan a circular y si no son capaces de aprender, pues que les sancionen con asistencia a cursos de educación vial.",YES,PREMISE,REASON
2513-29064-2,"Yo llevo 20 años en Madrid montando en bicicleta y con patines también he ido a muchas bicicríticas, y he visto de todo, tanto en coches como en bicicletas, pero lo de las bicicletas en las aceras me parece muy mal, sobre todo las eléctricas.",NO,SPAM,NONE
2513-29129-0,"El caso es que en las ciudades donde la bicicleta es mayoritaria, como Amsterdam o Copenhague la gente convive con las bicicletas de otra manera.",YES,CLAIM,NONE
2513-29129-1,Se ven un montón de calles peatonales y plazas donde pasan bicicletas a ritmo de peatón y los peatones no se alteran ni se enfadan porque están en su derecho ya que allí se les permite en este tipo de lugares.,YES,PREMISE,EXPLANATION
2513-29129-2,Se puede ver en un montón de vídeos en Youtube.,YES,PREMISE,PRECISION
2513-29131-0,"Si yo quisiera tener bronca, me puedo encontrar con cincuenta o sesenta peatones en un tramo de 4 o 5 km invadiendo el carril bicicleta en la zona del parque las cruces y tienen su paseo al lado.",NO,SPAM,NONE
2513-29131-1,"Personalmente no me molesta mientras no tenga que parar para pasar, pero seguro que alguno de ellos son los que se molestan tanto con las bicicletas por las aceras.",YES,PREMISE,OPPOSITION
2513-74914-0,"Pasan el miedo a los peatones donde no sobran accidentes, La bicicleta supera la velocidad peatones.",NO,SPAM,NONE
2513-28970-0,"Quizás, y sólo quizás, sea porque Madrid no es un lugar muy acogedor para las bicicletas.",YES,CLAIM,NONE
2513-28970-1,"A lo mejor la gente que va por la acera prefiere no jugarse la vida mientras respira a pulmón limpio el tubo de escape del que va delante, en determinados tramos.",YES,PREMISE,RESTATEMENT
2513-28970-2,Solución carriles bicicleta de verdad y no de paseo.,YES,PREMISE,CONCLUSION
2513-28977-0,Totalmente de acuerdo.,YES,CLAIM,NONE
2513-28977-1,"No es que yo esté a favor de que las bicicletas vayan por la acera, pero hacen falta carriles bicicleta en condiciones por todo Madrid.",YES,CLAIM,NONE
2513-28979-0,Os invito a votar: Hay un problema de duplicidades en el diseño de esta web.,NO,SPAM,NONE
2513-29141-0,"Una de las ventajas, entre otras, de las bicicletas es que no pagas impuestos por usarla.",YES,CLAIM,NONE
2513-29141-1,Imagino que la matriculación no será gratis.,YES,CLAIM,NONE
2513-29141-2,Como ventaja veo más interesante que en caso de robo se podría identificar más fácilmente.,YES,PREMISE,CONCESSION
2513-29939-0,Muy buena propuesta.,NO,SPAM,NONE
2513-29939-1,"Ya está bien de que una bicicleta, que es un vehículo como otros, cometan infracciones sin posibilidad de ser identificados.",YES,CLAIM,NONE
2513-29939-2,Todo mi apoyo.,NO,SPAM,NONE
2513-95864-0,"Todos los ciudadanos son identificados por su DNI Incluso los peatones pueden ser sancionados por cruzar por lugares indebidos, por tanto, no por ello se necesita un vehículo para usar mal las vías públicas.",YES,CLAIM,NONE
2513-95864-1,Un saludo.,NO,SPAM,NONE
2513-96649-0,Por eso llevan matrículas las motos y los coches.,NO,SPAM,NONE
2513-96649-1,Todo aquel vehículo que circule por las vías comunes debería llevar una matrícula para así no tener la posibilidad de evitar sanciones.,YES,CLAIM,NONE
2513-96649-2,Y creo que las bicicletas lo son.,YES,PREMISE,PRECISION
2513-96649-3,"Ya basta de que estos seres de luz se pasen por el arco del triunfo los semáforos, el circular por aceras, la marcha en sentido contrario y otras barbaridades que por frecuentes son casi universales en este tipo de vehículos.",YES,CLAIM,NONE
2513-65482-0,En contra.,NO,SPAM,NONE
2513-65482-1,"La obligatoriedad de una matricula desincentiva el uso de la bicicleta, que en Madrid mejora la movilidad y no aumenta la contaminación.",YES,CLAIM,NONE
2551-0-0,Trasladar celebraciónes día del orgullo gay fuera de la ciudad,NO,SPAM,NONE
2551-0-0,Los días de celebración se convierten en un inconveniente para los vecinos y ciudadanos afectados teniendo que ser participes de una fiesta sin poder elegir.,YES,CLAIM,NONE
2551-0-0,"Una celebración mayormente controlada y organizada en una zona fuera de centro de la ciudad no evitara a los participes de su fiesta, sin alterar la vida del resto de vecinos que sufren los efectos negativos de la misma.",YES,CLAIM,NONE
2551-0-1,"La ciudad no dejara de obtener beneficios económicos en comercios, hoteles, etc. Se puede organizar a modo de los macro festivales de musica, al no causar molestias al resto de ciudadanos se puede ilimitar la duración de la fiesta.",YES,PREMISE,ALTERNATIVE
2551-0-2,"Mayor fiesta, menor molestia a resto de ciudadanos y los mismos ingresos.",YES,PREMISE,CONCLUSION
2551-0-3,Todos contentos.,NO,SPAM,NONE
2551-29397-0,"Estoy muy de acuerdo, la última fue insufrible para los vecinos de Centro, por lo largo, la suciedad y el ruido.",NO,SPAM,NONE
2551-30208-0,Si pero eso solo lo sabe el vecino que lo sufre.,YES,CLAIM,NONE
2551-30208-1,Es muy bonito ir de fiesta uno y que los demás se fastidien.,YES,CLAIM,NONE
2551-30208-2,"Ruidos, suciedades, cortes de tráfico etc.",YES,PREMISE,EXEMPLIFICATION
2551-30208-3,"Y no hablamos de un par de horas, son días y horas interminables para los que lo sufrimos.",YES,PREMISE,ADDITION
2551-29534-0,"Yo voto para que no se célebre nunca más ningúna victoria deportiva dentro de la capital nada de victorias en la Cibeles o paseillos de la selección española por la gran vía o el paseo de Recoletos, tampoco desfiles militares, .",YES,CLAIM,NONE
2551-29534-1,"Ya está bien de masificaciones, manifestaciones y cottes de tráfico.",YES,CLAIM,NONE
2551-29534-2,A trabajar como Dios manda y a circular todos correctamente.,YES,CLAIM,NONE
2551-29534-3,¿Qué le parece esta propuesta?,NO,SPAM,NONE
2551-29534-4,La votaría?,NO,SPAM,NONE
2551-29534-5,"Porque de todo eso, salvo las manifestaciones, nadie se queja.",NO,SPAM,NONE
2551-30120-0,"Pues ponga la propuesta, pero analice las diferencias que son muchas.",NO,SPAM,NONE
2551-30120-1,No hay mayor ciego que el que no quiere ver.,NO,SPAM,NONE
2551-29541-0,Totalmente de acuerdo.,NO,SPAM,NONE
2551-31040-0,"Estoy en total acuerdo, si me llaman homofogo me da igual pero las truchas al río que hacen menos ruido.",YES,CLAIM,NONE
2551-31042-0,"A demás que la tolerancia es cosa de ambas partes, nosotros tenemos que aguantar no entiendo la fiesta porque tampoco hay la fiesta del orgullo heterosexual, somos personas a pesar de la condición y no tiene a que esa fiesta.",YES,PREMISE,COMPARISON
2551-39938-0,"Se te va la olla, en serio.",YES,PREMISE,CONCLUSION
2551-88145-0,Invitaría a los responsables municipales en este área a que vengan a oler por las calles aledañas a la Plaza de España.,NO,SPAM,NONE
2551-88145-1,"Son con los olores que duermo durante las fiestas del Orgullo, el de las micciones de cientos de personas.",YES,CLAIM,NONE
2551-88145-2,"Claro que se concilia el sueño por cansancio ya avanzada la madrugada y una vez que termina la algarabía, no sólo de los altavoces del escenario.",YES,PREMISE,RESULT
2551-88145-3,"Nadie en mi barrio quiere esas fiestas, pregunten a comerciantes, también de bares y restaurantes.",YES,CLAIM,NONE
2551-88145-4,Es la imposición de un colectivo.,YES,PREMISE,PRECISION
2551-88145-5,Espero que se pueda actuar por parte del ayuntamiento para evitar las múltiples incomodidades que tendremos que aguantar los vecinos.,NO,SPAM,NONE
2576-0-0,Contratar personal de limpieza,YES,CLAIM,NONE
2576-0-0,Contratar personal de limpieza en lugar de pedir a universitarios o madres de niños escolarizados limpiar.,YES,CLAIM,NONE
2576-0-0,"En noticias recientes, hemos visto cómo Carmena pretende que los universitarios barran Madrid, al igual que manifestó hace unos meses con las madres de los niños escolarizados.",NO,SPAM,NONE
2576-0-1,"Mi propuesta es, en lugar de promover que estudiantes o mujeres trabajadoras hagan ese trabajo, ¿por qué no se contrata a más personal de limpieza?",YES,CLAIM,NONE
2576-0-2,"De esta forma se podría reducir el paro de la capital, a la vez que no se quita tiempo de estudio a los universitarios o tiempo libre a las mujeres.",YES,PREMISE,RESULT
2576-0-3,"O si por contra prefiere limpieza de forma gratuita, ¿por qué no limpian las calles los concejales de Ahora Madrid?.",NO,SPAM,NONE
2576-29487-0,Este sitio no es el lugar creo yo.,YES,CLAIM,NONE
2576-29487-1,"Pero ya que te poner, haz un esfuerzo por contrastar esa noticia que sé dónde la has leído.",YES,PREMISE,OPPOSITION
2576-29487-2,Aquí te lo paso: .,NO,SPAM,NONE
2576-29576-0,"En ese enlace que me has pasado sólo habla de remunicipalizar servicios, no de que limpien universitarios.",NO,SPAM,NONE
2576-29576-1,"Es una medida que me parece injusta, puesto que la mayoría no ha podido votar la composición del Ayuntamiento de Madrid, las universidades son competencia de la Comunidad de Madrid y, por tanto, la alcaldesa no tiene legitimidad para hacerles limpiar las calles.",YES,CLAIM,NONE
2576-39087-0,No has entendido o no quieres entender.,YES,CLAIM,NONE
2576-39087-1,"No se trata de obligarles a limpiar por supuesto, pero si a concienciar a todos los que ensucian de forma innecesaria su entorno lo que no deben hacer y no rasgarnos las vestiduras por ello.",YES,PREMISE,RESTATEMENT
2576-29604-0,"Perdona pero no has entendido nada, lo de las madres era una propuesta por mi parte muy interesante ya que si dichas madres están en el paro y pueden tener un trabajo además en el colegio donde va su hijo pues mucho mejor y lo de los jovenes estudiantes también es lógico que al que ensucie se le enseñe a dejar de hacerlo, no para no tener que contratar a personas que limpien si no para evitar el que convirtamos a nuestros hijos en unos guarros.",YES,PREMISE,EXPLANATION
2576-29614-0,"En primer lugar, los empleos públicos no se deberían ofrecer en función de en qué colectivo te encuentres, sino a todos los ciudadanos por igual.",YES,CLAIM,NONE
2576-29614-1,"En segundo lugar, muéstrame una encuesta que diga que sólo los universitarios ensucian la calle.",YES,CLAIM,NONE
2576-29614-2,"En tercer lugar, para evitar que la gente ensucie ya están las multas o pueden limpiar ellos, pero no hay que generalizar con todo el colectivo universitario.",YES,CLAIM,NONE
2576-31661-0,"Por supuesto que no sólo los universitarios ensucian, es que de hecho no todos los universitarios ensucian, posiblemente sean una minoría, pero lo cierto es que encucian muchos de ellos, y no está de más concienciar a todos de que la limpieza no es una deshonrra, en el colegio de mi hijo hacen batallón de reciclaje, hacen grupos de trabajo semanales y conciencian al resto informando y vigilando que cumplen con las normas de limpieza del colegio, que tiene de malo eso.",YES,CLAIM,NONE
2576-31661-1,"Por otro lado los empleos públicos se deben ofrecer a todos los ciudadano pero si saliera una oferta de empleo público para limpiar un colegio de la zona donde tu vivas y otro donde yo viva, entiendo que tu si estuvieras interesad@o la solicitarías en la zona que más cerca te pille y yo igual, por lo tanto que problema hay?.",YES,PREMISE,OPPOSITION
2576-31661-2,"Y por último no he visto nunca a un agente multando a nadier por dejar que su perro se cague en la calle y no recoja la caquita, cosa que podían empezar también a vigilar.",YES,CLAIM,NONE
2576-29702-0,"Yo creo que todo parte de un malentendido por no tener el video completo de todo lo que dijese la alcaldesa ese día, yo propongo que se use la web para aclarar lo sucedido sin llevarnos las manos a la cabeza, que cuelguen el video completo y así podamos opinar.",YES,CLAIM,NONE
2576-29987-0,"En Aluche tenemos este problema con la suciedad y dejadez del barrio, por favor votad.",NO,SPAM,NONE
2576-30389-0,"Hola, soy universitaria y mi facultad, la de educación qué ironía da pena verla.",NO,SPAM,NONE
2576-30389-1,"Los fines de semana, por las noches, se reúne tal cantidad de gente a hacer botellón que hay que ir con cuidado para no atropellar a nadie.",NO,SPAM,NONE
2576-30389-2,No solo la gente que hace botellón ensucia mi facultad y otras facultades si no que los propios alumnos durante el día no son capaces de tirar sus desperdicios a la basura.,YES,CLAIM,NONE
2576-32017-0,Coincido contigo.,NO,SPAM,NONE
2576-32017-1,"En mis tiempos de universitario, todo de muy buen rollo y eso, pero cada vez que se hacía la fiesta de la primavera, o cualquier otra, se pedía insistentemente que la gente tirase los envases en los depósitos habilitados, y que ayudase a dejar la zona limpia para que no quedase como si hubiese pasado Atila con su tropa.",NO,SPAM,NONE
2576-32017-2,Pues nada de esto funciona.,YES,CLAIM,NONE
2576-32017-3,"Ni el por favor, ni el buen rollo ni nada de nada.",YES,PREMISE,ADDITION
2576-32017-4,"Los botelleros solo piensan en divertirse como sea, y les importa un comino si queda destrozado, sucio, o lo que sea.",YES,PREMISE,CONCLUSION
2576-73836-0,Madrid libre de excrementos vota.,NO,SPAM,NONE
2576-30752-0,Apoyo y añado otra propuesta.,NO,SPAM,NONE
2576-33718-0,Creo que nuestras propuestas son complementarias.,NO,SPAM,NONE
2576-34452-0,"A buen entendederas, pocas palabras bastan, pero en esta propuesta veo muuuchas palabras.",YES,PREMISE,OPPOSITION
2576-58608-0,"Aplaudo tu iniciativa, y creo podría que además podría tener una repercusión social importante empleo que podría además centrarse en los colectivos más necesitados y más próximos a esa actividad.",NO,SPAM,NONE
2576-58608-1,"Te Sugiero que consultes, y si te parece apoyes, la propuesta: .",NO,SPAM,NONE
2576-77498-0,Os proporngo otra forma de generar empleo y ayudar a las familias sin recursos.,NO,SPAM,NONE
2576-77498-1,"Teniendo en cuenta que en Madrid, los bancos de alimentos independientes que funcionan cuentan con tan sólo 4 asalariados y 450 voluntarios, la creación de un un banco de alimentos de gestión municipal y pública generaría un número de entorno a 500 empleos para la coordinación de la recogida, almacenamiento y entrega de comida a familias sin recursos.",YES,CLAIM,REASON
2576-89800-0,Te dejo esta propuesta por si te interesa.,NO,SPAM,NONE
2576-94253-0,Con respecto a la limpieza hay un problema bastante gordo.,YES,CLAIM,NONE
2576-94253-1,La herencia recibida que tanto les gusta a algunos viene al pelo.,NO,SPAM,NONE
2576-94253-2,Y es que la señora Botella y Gallardón hicieron contratos con las empresas actuales que superaban sus años de legislatura.,YES,CLAIM,NONE
2576-94253-3,Empresas como la de Florentino Pérez amiguito de Aznar y gentuza explotadora de la misma calaña que recorta en sus empresas y repercute en el servicio que dan.,YES,PREMISE,ADDITION
2576-94253-4,Con esto quiero decir que la problemática está en que prepararon la cama a sus amiguitos y ahora las culpas vienen para el que viene detrás.,YES,PREMISE,RESTATEMENT
2576-94253-5,Con Botella los parques estaban peor.,YES,PREMISE,ADDITION
2576-94253-6,"Quizá los del barrio Salamanca no, pero los demás estaban hechos una porquería.",YES,PREMISE,CONCESSION
2576-94253-7,Por otro lado los que hacen botellones deberían recoger los desperdicios y a demás no mear en vía pública o reventar botellas y demás actos vandálicos.,YES,PREMISE,ALTERNATIVE
2576-94253-8,"No multar por beber, sino multar por ese tipo de comportamientos.",YES,PREMISE,CONCLUSION
26277-0-0,No a la construcción de 1200 viviendas sociales de la EMVS en el Cañaveral,YES,CLAIM,NONE
26277-0-0,La vivienda social debe repartirse equitativamente entre todos los barrios de Madrid que ya están consolidados y disponen de los recursos y servicios necesarios para garantizar la integración social.,YES,CLAIM,NONE
26277-200044-0,Esperamos que el ayuntamiento se conciencie de la barbaridad que son 1200 viviendas.,YES,CLAIM,NONE
26277-200044-1,Cuando hay más barrios de la capital que no tienen o no tienen tantisimos.,YES,PREMISE,COMPARISON
26277-200044-2,Y cuando hay miles de viviendas sin ocupar por todo Madrid!.,YES,PREMISE,PRECISION
26277-200088-0,El Cañaveral pertenece al distrito de Vicálvaro.,YES,CLAIM,NONE
26277-200088-1,"Ya que miras un plano, hazlo bien.",YES,PREMISE,CONCLUSION
26277-200103-0,"Distrito13, Claro que intenta confundir, pero solo lo intenta.",NO,SPAM,NONE
26277-200103-1,"Mire usted, la vivienda social es responsabilidad de todos los barrios y no solo de algunos.",YES,CLAIM,NONE
26277-200103-2,Concentrar viviendas sociales en solo algunos barrios de Madrid es marginar a esos barrios y a los beneficiarios de las viviendas sociales.,YES,PREMISE,ADDITION
26277-200112-0,"Distrito13, Claro que intenta confundir, pero solo lo intenta.",NO,SPAM,NONE
26277-200112-1,"Mire usted, la vivienda social es responsabilidad de todos los barrios y no solo de algunos.",YES,CLAIM,NONE
26277-200112-2,Concentrar viviendas sociales en solo algunos barrios de Madrid es marginar a esos barrios y a los beneficiarios de las viviendas sociales.,YES,PREMISE,ADDITION
26277-200135-0,Este tipo de ayuda social debe distribuirse de forma equitativa entre todos los distritos.,YES,CLAIM,NONE
26277-200135-1,No es justo ayudar a quienes no tienen recursos a costa de que los mismos soporten las consecuencias.,YES,CLAIM,NONE
26277-200135-2,"Y si alguien piensa que la integración de unos no tiene consecuencias para otros es porque, seguramente, no ha tenido que convivir en esas circunstancias.",YES,PREMISE,CONDITION
26277-200135-3,"No vale todo, señores y señoras.",NO,SPAM,NONE
26277-200135-4,Con medidas de este tipo solo consiguen más crispación social y fomentar la desigualdad y las diferencias entre las clases sociales.,YES,CLAIM,NONE
26277-200135-5,Si quieren igualdad e integración empiecen por repartir la carga de forma justa.,YES,PREMISE,CONCLUSION
26277-200287-0,"Soy inquilino de la EMVS en un piso en alquiler en el Ensanche de Vallecas, no en el Barrio de Salamanca ni barrios consolidados como dice usted.",NO,SPAM,NONE
26277-200287-1,"Tengo estudios, y no básicos sino Titulado superior con Master, tengo trabajo desde hace años y todo lo que puede considerarse una vida normal, lo único que no tengo es dinero para poder vivir solo en un alquiler de Madrid, o pago el alquiler o me alimento.",NO,SPAM,NONE
26277-200371-0,"estoy de acuerdo contigo, vivienda social en todos los barrios pero ya consolidados.",YES,CLAIM,NONE
26277-200371-1,"El cañaveral carece de servicios y dotaciones, pero no olvides que es distrito de Vicalvaro y aquí tenemos unas cuantas viviendas sociales.",YES,PREMISE,OPPOSITION
26277-200371-2,En el resto de distritos no pueden decir lo mismo.,YES,CLAIM,NONE
26277-200371-3,"Así que, por favor, no digas que la propuesta es discriminatoria, eso diselo a los distritos que no tienen viviendas sociales.",NO,SPAM,NONE
26277-200371-4,En Vicalvaro hay mucha vivienda social.,YES,CLAIM,NONE
26277-200406-0,"Pero en el Cañaveral no debe haberlas o no en gran número, si nó no se quejaría por ello.",YES,CLAIM,NONE
26277-200406-1,"Entiendo lo que quiero decir pero no me valen muchos de sus argumentos, es opinión personal.",NO,SPAM,NONE
26277-200406-2,"Creo que no puede ahora aferrarse al distrito Vicalvaro es como si no hubiera dotaciones en Nueva España, por ejemplo, y le dijeran a un vecino de estas: Pero en el distrito de Chamartín hay muchas.",YES,CLAIM,NONE
26277-200406-3,"O se queja por Vicalvaro en su conjunto, que no es su fin por lo que veo, o por el barrio en concreto, Cañaveral.",YES,CLAIM,NONE
26277-202908-0,"A lo mejor, lo que se pretende es que no metan 5 bloques de gitanos como hicieron en Gavia.",YES,CLAIM,NONE
26277-202908-1,"Ahora cientos de vecinos de esa zona que pagaron barbaridades por su casa y las siguen pagando viven con ruido, inseguridad y suciedad en sus barrios.",YES,PREMISE,RESULT
26277-202908-2,Solo ese es el problema.,NO,SPAM,NONE
26277-200433-0,Yo suscribo la parte que dice que las viviendas sociales deben ser repartidas por todos los barrios donde sea posible.,NO,SPAM,NONE
26277-200433-1,En algunos es prácticamente imposible en estos momentos y en otros es más fácil.,YES,CLAIM,NONE
26277-200433-2,"Pero leyendo su propuesta, la conclusión que saco es que a usted lo que le interesa no es eso, sino que no construyan viviendas sociales en El Cañaveral, y lo de construir en otros barrios, más parece algo así como a mí que no me construyan cerca de donde vivo.",YES,CLAIM,NONE
26277-200487-0,El cañaveral es un barrio nuevo que esta en pleno desarrollo y carece de servicios y dotaciones.,YES,CLAIM,NONE
26277-200487-1,"No hay transporte ni comunicación, ni colegios.",YES,PREMISE,PRECISION
26277-200487-2,Ve usted ve usted lógico y razonable construir 1200 viviendas aquí en lugar de otros distritos ya consolidados?.,YES,PREMISE,PRECISION
26277-200775-0,"Ya está bien, repartan las familias entre más barrios, no solo en estos, por que no les llevan a la zona de Aravaca, o algún solar que tengan en el barrio de Salamanca, siempre son los mismos barrios lo que soportan estas viviendas, y si no la señora Carmena que los lleve a su chalet, y les haga un hueco.",YES,CLAIM,NONE
26277-205328-0,"¿Dónde están las viviendas sociales en Pozuelo de Alarcón, Aravaca, el barrio de Salamanca, etc. ?",NO,SPAM,NONE
26277-205328-1,o es que por ahí sólo hacen las justas para alojar a los del servicio que tienen en casa?.,NO,SPAM,NONE
26277-205328-2,Antes de dar viviendas lo que hay que hacer es educar y crear puestos de trabajo y luego hablamos de igualdad Madrid parece un gran ghetto gracias a las políticas que venden una falsa idea de preocupación por los demás cuando en realidad sólo les preocupan los votos de los que viven de las ayudas.,YES,CLAIM,NONE
26277-205328-3,"Si los que trabajamos de sol a sol luchamos para salir del ghetto, y resulta que nos preparan uno nuevos ghettos en barrios nuevos entonces apaga y vámonos, ¿Quién puede querer quedarse en un lugar así?.",YES,PREMISE,CONDITION
26277-205328-4,Los jóvenes que se han preparado se irán a otros países dispuestos a desarrollarse y aquí quedará una enorme ONG de gente que vive del cuento.,YES,PREMISE,RESULT
26277-205328-5,¿Quién querría mantener un país así?.,NO,SPAM,NONE
26277-205328-6,"No estoy de acuerdo con la especulación, pero menos con la devaluación.",YES,PREMISE,SUMMARY
26277-205328-7,Quien quiera piso que trabaje y se lo pague.,YES,CLAIM,NONE
26277-205376-0,"Yo no soy de matemáticas, pero pienso que las ayudas en vivienda y otros tienen que ser para los que trabajan y aportan o han aportado algo para la sociedad.",YES,CLAIM,NONE
